<transports xmlns:xsi="http://www.w3.org/2001/XMLSchema-instance"
            xsi:schemaLocation="http://wso2.com/schema/netty-transports/config netty-transports.xsd"
            xmlns="http://wso2.com/schema/netty-transports/config">
    <listeners>
        <listener
                id="jaxrs-http"
                host="127.0.0.1"
                port="7777"
                bossThreadPoolSize="2"
                workerThreadPoolSize="250"
                execHandlerThreadPoolSize="60"/>

        <listener
                id="jaxrs-https"
                host="127.0.0.1"
                port="8888"
                bossThreadPoolSize="2"
                workerThreadPoolSize="250"
                execHandlerThreadPoolSize="60"
                scheme="https"
                keyStoreFile="repository/resources/security/cert.jks"
                keyStorePass="secret"
                certPass="secret"/>

        <listener
                id="netty-gw"
                host="0.0.0.0"
                port="9090"
                bossThreadPoolSize="4"
                workerThreadPoolSize="8"
                execHandlerThreadPoolSize="60">
            <parameters>
                <parameter name="disruptor.wait.strategy">PHASED_BACKOFF</parameter>
                <parameter name="disruptor.buffer.size">1</parameter>
                <parameter name="disruptor.count">1</parameter>
                <parameter name="disruptor.eventhandler.count">1</parameter>
            </parameters>
        </listener>
    </listeners>

    <senders>
        <sender
                id="netty-gw"
                scheme="https"
                keyStoreFile="repository/resources/security/cert.jks"
                trustStoreFile="repository/resources/security/cert.jks"
                trustStorePass="secret"
                keyStorePass="secret"
                certPass="secret">
        <parameters>
            <parameter name="connection.pool.count">0</parameter>
        </parameters>
        </sender>
    </senders>
</transports>